{
  "$schema": "http://json-schema.org/draft-07/schema#",
  "type": "object",
  "properties": {
    "features": {
      "type": [
        "array"
      ],
      "items": {
        "type": [
          "string"
        ]
      }
    },
    "extraOptions": {
      "type": [
        "object"
      ]
    },
    "access": {
      "type": [
        "array"
      ],
      "items": {
        "type": [
          "string"
        ]
      }
    },
    "onboardingTasks": {
      "type": [
        "array"
      ],
      "items": {
        "type": [
          "object"
        ],
        "properties": {
          "task": {
            "type": [
              "string",
              "null"
            ]
          },
          "status": {
            "type": [
              "string"
            ]
          },
          "user": {
            "type": [
              "null",
              "object"
            ]
          },
          "completionSeen": {
            "type": [
              "string",
              "null"
            ],
            "format": "date-time"
          },
          "dateCompleted": {
            "type": [
              "string"
            ],
            "format": "date-time"
          },
          "data": {}
        }
      }
    },
    "id": {
      "type": ["integer", "string", "null"]
    },
    "slug": {
      "type": [
        "string"
      ]
    },
    "status": {
      "type": [
        "string"
      ]
    },
    "name": {
      "type": [
        "string"
      ]
    },
    "dateCreated": {
      "type": ["string", "null"],
      "format": "date-time"
    },
    "isEarlyAdopter": {
      "type": [
        "boolean"
      ]
    },
    "require2FA": {
      "type": [
        "boolean"
      ]
    },
    "avatar": {
      "type": [
        "object"
      ],
      "properties": {
        "avatarType": {
          "type": [
            "string"
          ]
        },
        "avatarUuid": {
          "type": [
            "string",
            "null"
          ]
        },
        "avatarUrl": {
          "type": [
            "string",
            "null"
          ]
        }
      }
    },
    "links": {
      "type": [
        "object"
      ],
      "properties": {
        "organizationUrl": {
          "type": [
            "string"
          ]
        },
        "regionUrl": {
          "type": [
            "string"
          ]
        }
      }
    },
    "hasAuthProvider": {
      "type": [
        "boolean"
      ]
    },
    "allowMemberInvite": {
      "type": [
        "boolean"
      ]
    },
    "allowMemberProjectCreation": {
      "type": [
        "boolean"
      ]
    },
    "allowSuperuserAccess": {
      "type": [
        "boolean"
      ]
    },
    "text_content": {
      "type": ["string", "null"],
      "description": "Combined text content for search and embedding"
    },
    "version": {
      "type": ["string", "null"]
    },
    "shortVersion": {
      "type": ["string", "null"]
    },
    "ref": {
      "type": ["string", "null"]
    },
    "url": {
      "type": ["string", "null"]
    },
    "dateReleased": {
      "type": ["string", "null"],
      "format": "date-time"
    },
    "deployCount": {
      "type": ["integer", "null"]
    },
    "commitCount": {
      "type": ["integer", "null"]
    },
    "newGroups": {
      "type": ["integer", "null"]
    },
    "authors": {
      "type": ["array", "null"],
      "items": {
        "type": ["object", "null"],
        "properties": {
          "name": { "type": ["string", "null"] },
          "email": { "type": ["string", "null"] }
        }
      }
    },
    "lastCommit": {
      "type": ["object", "null"]
    },
    "lastDeploy": {
      "type": ["object", "null"]
    },
    "firstEvent": {
      "type": ["string", "null"]
    },
    "lastEvent": {
      "type": ["string", "null"]
    },
    "projects": {
      "type": ["array", "null"],
      "items": {
        "type": ["object", "null"],
        "properties": {
          "id": { "type": ["integer", "string", "null"] },
          "name": { "type": ["string", "null"] },
          "slug": { "type": ["string", "null"] },
          "platform": { "type": ["string", "null"] },
          "platforms": { 
            "type": ["array", "null"],
            "items": { "type": ["string", "null"] }
          },
          "newGroups": { "type": ["integer", "null"] },
          "hasHealthData": { "type": ["boolean", "null"] }
        }
      }
    },
    "owner": {
      "type": ["string", "null"]
    },
    "userAgent": {
      "type": ["string", "null"]
    },
    "versionInfo": {
      "type": ["object", "null"],
      "properties": {
        "buildHash": { "type": ["string", "null"] },
        "description": { "type": ["string", "null"] },
        "package": { "type": ["string", "null"] },
        "version": { "type": ["object", "null"] }
      }
    },
    "data": {
      "type": ["object", "null"]
    },
    "currentProjectMeta": {
      "type": ["object", "null"]
    },
    "project_id": {
      "type": ["string", "integer", "null"]
    },
    "project_slug": {
      "type": ["string", "null"]
    }
  },
  "key_properties": ["version"]
}