{
  "id": "12345",
  "version": "1.2.3",
  "shortVersion": "1.2.3",
  "ref": "6ba7b814-9dad-11d1-80b4-00c04fd430c8",
  "url": "https://sentry.io/api/0/organizations/split-software/releases/1.2.3/",
  "dateCreated": "2023-05-17T12:30:45Z",
  "dateReleased": "2023-05-17T14:20:00Z",
  "deployCount": 3,
  "commitCount": 42,
  "newGroups": 5,
  "authors": [
    {
      "name": "John Developer",
      "email": "john@example.com"
    },
    {
      "name": "Jane Engineer",
      "email": "jane@example.com"
    }
  ],
  "lastCommit": {
    "id": "3f5c44856e2e4f35865fe70c82bbfa7a",
    "message": "Fix critical bug in authentication flow",
    "dateCreated": "2023-05-16T22:15:30Z",
    "author": {
      "name": "Jane Engineer",
      "email": "jane@example.com"
    }
  },
  "lastDeploy": {
    "id": "5c48f742a9bc49f2b7c0e82f5b7e876c",
    "environment": "production",
    "name": "Production Deploy",
    "dateStarted": "2023-05-17T14:00:00Z",
    "dateFinished": "2023-05-17T14:20:00Z",
    "status": "success"
  },
  "firstEvent": "2023-05-17T14:25:12Z",
  "lastEvent": "2023-05-18T09:43:27Z",
  "projects": [
    {
      "id": 123,
      "name": "Backend API",
      "slug": "backend-api",
      "platform": "python",
      "platforms": ["python"],
      "newGroups": 3,
      "hasHealthData": true
    },
    {
      "id": 456,
      "name": "Frontend App",
      "slug": "frontend-app",
      "platform": "javascript",
      "platforms": ["javascript", "react"],
      "newGroups": 2,
      "hasHealthData": true
    }
  ],
  "owner": "team-backend",
  "status": "active",
  "userAgent": "Mozilla/5.0 (Macintosh; Intel Mac OS X 10_15_7)",
  "versionInfo": {
    "buildHash": "a1b2c3d4e5f6g7h8i9j0",
    "description": "May 2023 Production Release",
    "package": "com.example.app",
    "version": {
      "buildCode": "10203",
      "components": 3,
      "major": 1,
      "minor": 2,
      "patch": 3,
      "pre": null,
      "raw": "1.2.3"
    }
  },
  "data": {
    "releaseNotes": "Fixed authentication bugs and improved performance",
    "releaseType": "regular",
    "buildStatus": "successful"
  }
}
